{"$schema":"https://json-schema.org/draft/2020-12/schema","$id":"https://copenhagen.today/contracts/publication-receipt.v1.schema.json","type":"object","additionalProperties":false,"required":["schema_version","edition_id","web","device","bundle"],"properties":{"schema_version":{"const":1},"edition_id":{"type":"string"},"web":{"type":"object","additionalProperties":false,"required":["story_ids"],"properties":{"story_ids":{"type":"array","items":{"type":"string"}}}},"device":{"type":"object","additionalProperties":true,"required":["status","story_ids","omitted","dropped_callouts","structural_elements"],"properties":{"status":{"enum":["published","failed","skipped"]},"story_ids":{"type":"array","items":{"type":"string"}},"omitted":{"type":"array"},"dropped_callouts":{"type":"array"},"structural_elements":{"type":"array"}}},"bundle":{"type":"object","additionalProperties":false,"required":["path"],"properties":{"path":{"type":"string","pattern":"^n/[a-z0-9][a-z0-9_-]{0,79}/$"}}}}}
