{"bundle":{"path":"n/2026-09-18-afternoon/"},"device":{"composition":"lead-wide","dropped_callouts":[{"index":0,"reason":"overflow","story_id":"buffett-steps-down"}],"omitted":[{"reason":"capacity","story_id":"free-book-packages-daycare"},{"reason":"capacity","story_id":"road-running-worlds-copenhagen"},{"reason":"capacity","story_id":"eu-pays-ukraine-3-3bn-euro"},{"reason":"capacity","story_id":"motor-register-hole-still-open"},{"reason":"capacity","story_id":"king-harald-sarcophagus"},{"reason":"capacity","story_id":"novo-orbis-pill-deal"},{"reason":"capacity","story_id":"aarhus-bus-tickets-15-kroner"},{"reason":"capacity","story_id":"deepfake-ads-meta-danish-child"},{"reason":"capacity","story_id":"russia-duma-vote-opens"},{"reason":"capacity","story_id":"us-f35-saudi-sale"},{"reason":"capacity","story_id":"trump-drops-ice-nominee"},{"reason":"capacity","story_id":"andersson-tasked-forming-government"},{"reason":"capacity","story_id":"poll-df-twice-venstre"},{"reason":"capacity","story_id":"eu-first-co2-storage-opens"}],"placements":[{"callout_index":0,"copy_variant":null,"headline_variant":"headline_short","role_as_placed":"lead","slot":"lead","story_id":"police-resume-child-certificates"},{"callout_index":null,"copy_variant":"short","headline_variant":"headline_short","role_as_placed":"secondary","slot":"secondary-1","story_id":"denmark-ukraine-aid-brought-forward"},{"callout_index":null,"copy_variant":"short","headline_variant":"headline_short","role_as_placed":"secondary","slot":"secondary-2","story_id":"buffett-steps-down"},{"callout_index":null,"copy_variant":"short","headline_variant":"headline_short","role_as_placed":"secondary","slot":"secondary-3","story_id":"siddique-expelled-city-council"},{"callout_index":null,"copy_variant":null,"headline_variant":"headline","role_as_placed":"brief","slot":"brief-1","story_id":"maersk-orders-26-ships"},{"callout_index":null,"copy_variant":null,"headline_variant":"headline","role_as_placed":"brief","slot":"brief-2","story_id":"onshore-wind-cap-removed"},{"callout_index":null,"copy_variant":null,"headline_variant":"headline","role_as_placed":"brief","slot":"brief-3","story_id":"residence-duty-fine-quintupled"},{"callout_index":null,"copy_variant":null,"headline_variant":"headline","role_as_placed":"brief","slot":"brief-4","story_id":"kasper-holten-leaves-royal-theatre"}],"status":"published","story_ids":["police-resume-child-certificates","denmark-ukraine-aid-brought-forward","buffett-steps-down","siddique-expelled-city-council","maersk-orders-26-ships","onshore-wind-cap-removed","residence-duty-fine-quintupled","kasper-holten-leaves-royal-theatre"],"structural_elements":[]},"edition_id":"2026-09-18-afternoon","schema_version":1,"web":{"story_ids":["police-resume-child-certificates","denmark-ukraine-aid-brought-forward","buffett-steps-down","siddique-expelled-city-council","eu-first-co2-storage-opens","poll-df-twice-venstre","maersk-orders-26-ships","onshore-wind-cap-removed","residence-duty-fine-quintupled","kasper-holten-leaves-royal-theatre","andersson-tasked-forming-government","trump-drops-ice-nominee","us-f35-saudi-sale","russia-duma-vote-opens","deepfake-ads-meta-danish-child","aarhus-bus-tickets-15-kroner","novo-orbis-pill-deal","king-harald-sarcophagus","motor-register-hole-still-open","eu-pays-ukraine-3-3bn-euro","road-running-worlds-copenhagen","free-book-packages-daycare"]}}